[
  {
    "ioc_id": "ioc-ip-001",
    "ioc_type": "ip",
    "value": "185.220.101.200",
    "severity": "high",
    "confidence": 0.92,
    "source": "threat-feed-test",
    "tags": ["c2", "malware", "botnet"],
    "first_seen": "2026-04-01T00:00:00Z",
    "last_seen": "2026-05-14T00:00:00Z",
    "expires_at": null,
    "ttl_seconds": null,
    "active": true,
    "created_at": "2026-05-15T08:00:00Z",
    "normalization_version": "ioc-v1"
  },
  {
    "ioc_id": "ioc-domain-001",
    "ioc_type": "domain",
    "value": "randomlookingdomainc2beacon12345.dynamic.invalid",
    "severity": "high",
    "confidence": 0.88,
    "source": "threat-feed-test",
    "tags": ["c2", "dga", "beacon"],
    "first_seen": "2026-05-10T00:00:00Z",
    "last_seen": "2026-05-14T00:00:00Z",
    "expires_at": null,
    "ttl_seconds": null,
    "active": true,
    "created_at": "2026-05-15T08:00:00Z",
    "normalization_version": "ioc-v1"
  },
  {
    "ioc_id": "ioc-hash-001",
    "ioc_type": "file_hash",
    "value": "e3b0c44298fc1c149afbf4c8996fb92427ae41e4649b934ca495991b7852b855",
    "severity": "critical",
    "confidence": 0.95,
    "source": "threat-feed-test",
    "tags": ["dropper", "malware", "stage1"],
    "first_seen": "2026-05-01T00:00:00Z",
    "last_seen": "2026-05-15T00:00:00Z",
    "expires_at": null,
    "ttl_seconds": null,
    "active": true,
    "created_at": "2026-05-15T08:00:00Z",
    "normalization_version": "ioc-v1"
  },
  {
    "ioc_id": "ioc-ip-expired-001",
    "ioc_type": "ip",
    "value": "192.0.2.100",
    "severity": "medium",
    "confidence": 0.70,
    "source": "threat-feed-test",
    "tags": ["scanner"],
    "first_seen": "2024-01-01T00:00:00Z",
    "last_seen": "2024-06-01T00:00:00Z",
    "expires_at": "2024-12-31T23:59:59Z",
    "ttl_seconds": null,
    "active": true,
    "created_at": "2026-05-15T08:00:00Z",
    "normalization_version": "ioc-v1"
  },
  {
    "ioc_id": "ioc-domain-inactive-001",
    "ioc_type": "domain",
    "value": "old-c2-sinkholed.invalid",
    "severity": "high",
    "confidence": 0.80,
    "source": "threat-feed-test",
    "tags": ["c2", "sinkholed"],
    "first_seen": "2025-01-01T00:00:00Z",
    "last_seen": "2025-06-01T00:00:00Z",
    "expires_at": null,
    "ttl_seconds": null,
    "active": false,
    "created_at": "2026-05-15T08:00:00Z",
    "normalization_version": "ioc-v1"
  },
  {
    "ioc_id": "ioc-ip-001",
    "ioc_type": "ip",
    "value": "185.220.101.200",
    "severity": "high",
    "confidence": 0.92,
    "source": "threat-feed-test",
    "tags": ["c2", "malware"],
    "first_seen": "2026-04-01T00:00:00Z",
    "last_seen": "2026-05-14T00:00:00Z",
    "expires_at": null,
    "ttl_seconds": null,
    "active": true,
    "created_at": "2026-05-15T08:00:00Z",
    "normalization_version": "ioc-v1"
  }
]
